Unnamed: 0,Track.Name,Artist.Name,Genre,Beats.Per.Minute,Energy,Danceability,Loudness..dB..,Liveness,Valence.,Length.,Acousticness..,Speechiness.,Popularity,Track.Lyrics,Artist.Bio
1,Señorita,Shawn Mendes,canadian pop,117,55,76,-6,8,75,191,4,3,79,"[Chorus: Camila Cabello]
I love it when you call me señorita
I wish I could pretend I didn't need ya
But every touch is ooh-la-la-la
It's true, la-la-la
Ooh, I should be runnin'
Ooh, you keep me coming for ya

[Verse 1: Shawn Mendes]
Land in Miami
The air was hot from summer rain
Sweat drippin' off me
Before I even knew her name, la-la-la
It felt like ooh-la-la-la, yeah, no
Sapphire moonlight
We danced for hours in the sand
Tequila Sunrise
Her body fit right in my hands, la-la-la
It felt like ooh-la-la-la, yeah

[Chorus: Camila Cabello & Shawn Mendes, Camila Cabello]
I love it when you call me señorita
I wish I could pretend I didn't need ya
But every touch is ooh-la-la-la
It's true, la-la-la
Ooh, I should be runnin'
Ooh, you know I love it when you call me señorita
I wish it wasn't so damn hard to leave ya
But every touch is ooh-la-la-la
It's true, la-la-la
Ooh, I should be runnin'
Ooh, you keep me coming for ya

[Verse 2: Camila Cabello with Shawn Mendes]
Locked in the hotel
There's just some things that never change
You say we're just friends
But friends don't know the way you taste, la-la-la (La, la, la)
'Cause you know it's been a long time coming
Don't ya let me fall, oh
Ooh, when your lips undress me, hooked on your tongue
Ooh, love, your kiss is deadly, don't stop

[Chorus: Both, Camila Cabello & Shawn Mendes]
I love it when you call me señorita
I wish I could pretend I didn't need ya
But every touch is ooh-la-la-la
It's true, la-la-la
Ooh, I should be runnin'
Ooh, you know I love it when you call me señorita
I wish it wasn't so damn hard to leave ya (So damn hard to leave ya)
But every touch is ooh-la-la-la
It's true, la-la-la (True la-la)
Ooh, I should be runnin'
Ooh, you keep me coming for ya

[Outro: Both, Shawn Mendes & Camila Cabello]
All along, I've been coming for ya (For you)
And I hope it meant something to you (Oh)
Call my name, I'll be coming for ya (Coming for you)
Coming for ya (Coming for you)
For ya
For ya (Oh, she loves it when I call)
For ya
Ooh, I should be runnin'
Ooh, you keep me coming for ya","Shawn Mendes (born Shawn Peter Raul Mendes; August 8, 1998 in Toronto, Ontario, Canada) is a Canadian singer-songwriter. After posting a series of his cover versions to various video-sharing sites, Mendes earned a dedicated following of viewers. His mix of Ed Sheeran and Justin Bieber's styles also appealed to Island Records, who signed Mendes in 2014. That same year they released the then-15-year-old's debut single, ""Life of the Party."" American radio initially ignored it <a href=""https://www.last.fm/music/Shawn+Mendes"">Read more on Last.fm</a>"
2,China,Anuel AA,reggaeton flow,105,81,79,-4,8,61,302,8,9,92,"[Letra de ""China"" ft. Ozuna & J Balvin]

[Intro: Rikrok, Anuel AA, Daddy Yankee & Ozuna]
Honey came in and she caught me red-handed
Creeping with the girl next door
Mi mujer me estaba llamando (Woh, oh, oh)
Oh, oh, oh
D.Y
Dirili-Daddy
(Contigo perreando; Ozuna; ¡fuimo'!)

[Coro: Anuel AA, Daddy Yankee & Ozuna]
Mi mujer me estaba llamando
Pero yo no contesté (Uah, baby; sube)
Porque yo estaba contigo perreando
Y de ella me olvidé (Mami)
Dios mío, perdóname
No sé por qué yo le fallé (Fallé; uah)
Yo estaba en la disco perreando
Y con ella me enredé (Woh, oh, oh; ¡fuego!; uah)

[Post-Coro: Ozuna & Anuel AA]
Yo estaba en la disco perreando (Oh, oh; hah, ¡prr!)
Yo estaba en la disco perreando (Eh, eh, eh; uah)
Yo estaba en la disco perreando (Uah, uah; eh-eh)
Yo estaba en la disco perreando

[Verso 1: Ozuna]
De la forma en que me miraba (Woh, oh, oh)
Podía notar que ella tenía lo que en la disco buscaba (Bailaba)
Quería que me bailara (Woh, oh)
Y el DJ que la música nunca me la bajara
Y se está prendí'a en fuego (Fuego)
Que no se enamora, ella está pa'l juego (Pa'l juego)
Anda sola, nunca le baja a su ego (A su ego)
Me provoca y facilito me le pego (Me le pego)
Y es que se está prendí'a en fuego (En fuego)
Que no se enamora, ella esta pa'l juego (Pa'l juego, oh)
Anda sola, nunca le baja a su ego (A su ego)
Me provoca y facilito me le pego y es que (Jaja)

[Verso 2: Anuel AA, Ozuna & Daddy Yankee]
Yo tengo un problema de alcohol
Yo no sé por qué soy así (Así, así)
Pa' mí que el doctor estaba bebiendo
El día que yo nací (Mami, mami)
Baby, pon la mano en el suelo (Suelo)
Y juégate con el pelo (El pelo)
Tu cuerpo es puro veneno (Veneno)
Bebé, tú me lleva' al cielo (Baby; ¡duro!)
Tú me dejaste caer, pero ella me levantó (Uah)
Déjame, poca mujer, pero ella me levantó (Oh, oh, oh)
Y yo me emborraché y de ti me olvidé, eh (Eh), eh (Eh)
Y tú pelea' una y otra ve', baby, ya me cansé, eh (Eh), eh (Eh)
(Fuego; ¡rumba!)

[Coro: Ozuna, Anuel AA, Daddy Yankee, Daddy Yankee & Ozuna]
Mi mujer me estaba llamando
Pero yo no contesté (Uah, baby; sube)
Porque yo estaba contigo perreando
Y de ella me olvidé (Mami)
Dios mío, perdóname
No sé por qué yo le fallé (Fallé)
Yo estaba en la disco perreando
Y con ella me enredé (Woh, oh, oh; ¡fuego!; uah)

[Post-Coro: Daddy Yankee, Anuel AA & Ozuna]
Yo estaba en la disco perreando (Oh, oh; ¡prr!)
Yo estaba en la disco perreando (Eh, eh; eh, eh, eh)
Yo estaba en la disco perreando (Uah, uah; eh-eh)
Yo estaba en la disco perreando

[Verso 3: Daddy Yankee & Anuel AA]
(¡Da-ddy Yan-kee!)
Tú me ganaste
Me metiste en tu juego y me dañaste
El ticket semanal puede ser que en ti lo gaste
Me creo bichote tirando lo' peso' (-so')
Por 'tar ricota te doy pata' y queso
Sino peleemos, nunca regreso y por eso (¡Rrr!)
Yo me quiero ir pa' casa, pero tú no me dejas (Oh, oh, oh)
Ese culo e' una amenaza, ya me creo que ere' mi pareja (Let's go!)
Un shot (Ey), dos shot' (Ey), empezó el problema
Porque el alcohol se metió en mi sistema (Prr)
Quien vaya chotear ya lleva la querella
No me eche' la culpa, cúlpenla a ella (¡Fuego!)

[Verso 4: KAROL G]
Contigo me enredé (Me enredé)
Y con un par de tragos, baby, me solté (Me solté)
Me quedé contigo y no le contesté
No sé por qué fallé (Yeh, yeh)
Pero sí sé que rico la pasé (Ah)
Llegó la media noche (Noche)
Apena' empezaba el toque (Toque)
Es que mi novio me esperaba (Ah, ah)
Antes que fueran las doce (Doce)
Qué bien la pasamo' anoche (-noche)
Sé que fallé y que me perdone (Eh, eh)
Y si lo vuelvo a ver mañana (Ah)
Diré que no me conoce

[Verso 5: J Balvin]
J Balvin, man
Yo estaba en la disco perreando
Cuando con ella me envolví, sí (Wuh, wuh)
Mi mujer me estaba llamando
Y tuve que darle delete, y (Auch)
Y yo que no me dejo envolver (Wuh)
Villana, tú me hiciste caer
Ese booty que hasta un ciego puede ver
Y hasta el más santo quiere ser infiel (Leggo; yeh, yeh)

[Refrán: J Balvin & Daddy Yankee]
Cambiamos de escena (Ey)
De R.D. hasta Cartagena
Ere' la única que me llena
Si te cogió, pago mi condena, nena
Cambiamos de escena
De R.D. hasta Cartagena (Come on, come on)
Ere' la única que me llena (Leggo)
Si te cogió, pago mi condena, yeh (¡Fuimo'!)

[Coro: Daddy Yankee, Anuel AA, Ozuna & Karol G]
Mi mujer me estaba llamando
Pero yo no contesté (Uah, baby; sube)
Porque yo estaba contigo perreando
Y de ella me olvidé (Mami)
Dios mío, perdóname
No sé por qué yo le falle (Fallé; uah)
Yo estaba en la disco perreando
Y con ella me enredé
(Woh, oh, oh; ¡fuego!; uah; bebecita, bebecita)

[Post-Coro: Anuel AA, Daddy Yankee & Ozuna]
Yo estaba en la disco perreando (Oh, oh; hah, ¡prr!)
Yo estaba en la disco perreando (Eh, eh, eh; uah)
Yo estaba en la disco perreando
Yo estaba en la disco perreando","Emmanuel Gazmey Santiago, known professionally as Anuel AA, is a Puerto Rican rapper and singer, a pioneer of the Latin trap movement. Gazmey's music addresses themes such as street life, violence, sex, and drugs. One of his most popular catchphrases in his songs is ""Real Hasta la Muerte"" (Real Until Death). 

After being released from prison on July 17, 2018, Gazmey released his first full-length album titled Real Hasta la Muerte which contained 12 songs and landed at number one on the Billboard Top Latin Albums chart. <a href=""https://www.last.fm/music/Anuel+AA"">Read more on Last.fm</a>"
3,boyfriend (with Social House),Ariana Grande,dance pop,190,80,40,-4,16,70,186,12,46,85,"Ariana Grande - boyfriend (with Social House)
Lauv - fuck, i'm lonely (with Anne-Marie) - from “13 Reasons Why: Season 3”
Clairo - Softly
Gryffin - OMG (with Carly Rae Jepsen)
YUNGBLUD - Hope For The Underrated Youth
HAIM - Summer Girl
BROCKHAMPTON - I BEEN BORN AGAIN
Oliver Tree - Do You Feel Me?
Drake - Club Paradise
Sabrina Claudio - Holding The Gun
RAYE - Love Me Again
Foals - Black Bull
Flume - Quits
ILLENIUM - Blood (with Foy Vance)
Quality Control - Longtime
Ava Max - Freaking Me Out
Tyga - Bop
Lil Durk - Die Slow (feat. 21 Savage)
Mabel - OK (Anxiety Anthem)
Quality Control - Intro
Noah Cyrus - July
Tyler Childers - Country Squire
Julian Lamadrid - Neon
The Lumineers - Leader Of The Landslide
Alexander 23 - Another Summer Night Without You
Tove Lo - Bad As The Boys
Nicky Jam - Atrévete
Teyana Taylor - How You Want It?
Rich The Kid - Flex Up
Red Hearse - Everybody Wants You
Angel Olsen - All Mirrors
Luke Combs - Let's Just Be Friends - From The Angry Birds Movie 2
Death Cab for Cutie - Kids in '99
courtship. - Amy, Run For The Hills
YK Osiris - Shakira
Aya Nakamura - Pookie (feat. Lil Pump) - Remix
Miquela - Money
Denzel Curry - I Against I - Recorded at Spotify Studios NYC
Dave East - Everyday (feat. Gunna)
Kash Doll - Here I Go
Kiana - Playing With Fire
Tori Kelly - 2 Places
Volbeat - Die To Live
half•alive - ok ok?
Midland - Cheatin’ Songs
Chiiild - Count Me Out
Rapsody - Ibtihaj
R3HAB - Alive
NOTD - Keep You Mine
Lil West - Want Love
daydream Masi - Lately
99 Neighbors - Fake Pods
Yoshi Flower - Rolling Thunder
Channel Tres - Black Moses (feat. JPEGMAFIA)
Luh Kel - Pull Up
Raphael Saadiq - So Ready
Blue Nude - 20
Carnage - Slot Machine (feat. Prinze George)
Franklin - Drowning
Josh A - Outbreak
Ghostface Killah - Party Over Here
Korn - Cold
Vic Mensa - Let U Know
Conor Maynard - Not Over You
MisterWives - whywhywhy
The Highwomen - The Chain - From the Motion Picture Soundtrack ""The Kitchen""
Sheryl Crow - Tell Me When It’s Over
Ra Ra Riot - Belladonna
Snoh Aalegra - Situationship
Cassie - Teach Me
Hermitude - OneFourThree
Snoop Dogg - Countdown (feat. Swizz Beatz)
ricky retro - Freak On Me (feat. Icona Pop)
Lindsey Stirling - The Upside (feat. Elle King)
Abraham Mateo - Me Vuelvo Loco
Pitbull - 3 to Tango
Cousin Stizz - STP
NGeeYL - Lullaby (feat. Young Nudy)
The Growlers - Natural Affair (Single Edit)
morgxn - OMM!
William Bolton - Serendipity
Grandma - No Doors
Daniela Andrade - Polly Pocket
TisaKorean - Watermelon Booty
Tom Tripp - Glow
Navvy - If I Can't Have You
Lou The Human - Suspicious
Slow Hollows - You Are Now on Fire
Penny and Sparrow - Gumshoe
Mosa Wild - Honey
Bre Kennedy - Jealous Of Birds
Sharna Bass - 4:30am
tobi lou - Cheap Vacations (feat. Facer)
Pardison Fontaine - Shea Butter
Keke Palmer - Twerk N Flirt
Yungeen Ace - Mountains
Skillet - Victorious
TOOL - Sober","Ariana Grande is an American singer, songwriter, and actress. A multi-platinum, Grammy Award-winning recording artist. Born in Boca Raton, Florida, Grande began her career in 2008 in the Broadway musical, 13. She rose to prominence for her role as Cat Valentine in the Nickelodeon television series, Victorious (2010–2013) and in its spin-off, Sam & Cat (2013–2014). As she grew interested in pursuing a music career, Grande recorded songs for the <a href=""https://www.last.fm/music/Ariana+Grande"">Read more on Last.fm</a>"
4,Beautiful People (feat. Khalid),Ed Sheeran,pop,93,65,64,-8,8,55,198,12,19,86,"[Intro: Ed Sheeran]
We are, we are, we are
ما هستیم، هستیم، هستیم ...
[Verse 1: Ed Sheeran]
L.A. on a Saturday night in the summer
توی لس آنجلس و شب شنبه چله ی تابستون
Sundown and they all come out
خورشید غروب میکنه و همه میریزن بیرون
Lamborghinis and their rented Hummers
با لامبورگینی ها و هامر های اجاره شدشون
The party's on, so they're headin' downtown ('Round here)
پارتی شروع میشه، پس اونا دارن میان سمت مرکز شهر (دور و بر اینجا)
Everybody's lookin' for a come up
همه دنبال اینن که سریعتر آماده بشن و برسن به پارتی (ایهام، همه دنبال طلوع و روشنایی خورشید میگردن)
And they wanna know what you're about
و اونا میخوان بدونن که نظر تو چیه
Me in the middle with the one I love and
من و کسی که دوسش دارم وسطای راهیم و ...
We're just tryna figure everything out
فقط داریم تلاش میکنیم که از همه چی سر در بیاریم

[Pre-Chorus: Ed Sheeran]
We don't fit in well 'cause we are just ourselves
خوب با همدیگه کنار نمیایم چونکه ما فقط خودمونیم
I could use some help gettin' out of this conversation, yeah
میتونستم یه ذره کمگ بگیرم که از این بحث و جدل بکشیم بیرون، آره
You look stunning, dear, so don't ask that question here
خیلی خوشگل شدی(به نظر میای)، عزیزم، پس دیگه اون سوالو اینجا نپرس
This is my only fear: that we become
تنها ترسم اینه که: بشیم مثل ....

[Chorus: Ed Sheeran]
Beautiful people
آدمای خوشگل
Drop top, designer clothes
با ماشینای بدون سقفشون، و لباسای مارک دارشون
Front row at fashion shows
توی ردیف جلویی نمایش مد (فشن شو) میشینن
""What d'you do?"" and ""Who d'you know?""
چی کار میکنی؟ و چی میدونی؟
Inside the world of beautiful people
توی دنیای آدمای خوشگل
Champagne and rolled-up notes
شامپاین میزنیم و پولای رول شده رو آماده میکنیم
Prenups and broken homes
توافقای قبل از ازدواج و زوج هایی که از همدیگه طلاق گرفتن
Surrounded, but still alone
کلی آدم دور و برمونه، اما هنوزم تنهایییم
Let's leave the party
بیا این پارتی رو ول کنیم بریم

[Post-Chorus: Ed Sheeran]
That's not who we are (We are, we are, we are)
این رفتار اون کسی که هستیم نیستش (ما هستیم، هستیم، هستیم)
We are not beautiful
ما خوشگل (پولدار) نیستیم
Yeah, that's not who we are (We are, we are, we are)
اره، این رفتار اون کسی که هستیم نیستش (ما هستیم، هستیم، هستیم)
We are not beautiful (Beautiful)
ما خوشگل (پولدار) نیستیم (خوشگل)

[Verse 2: Khalid]
L.A., mmm, drove for hours last night and we made it nowhere (Nowhere, nowhere)
توی لس آنجلس، ممم، برای چند ساعت آخر شب رانندگی کردیم و به هیچ جا نرسیدیم (هیچ جا، هیچ جا)
I see stars in your eyes when we're halfway there (All night)
ستاره هارو توی چشمات میبینم وقتی نصف راهو تا اونجا میریم (تموم شب)
I'm not fazed by all them lights and flashin' cameras
من با همه ی چراغاشون و فلش دوربیناشون به هم ریخته نمیشم (حواسم از تو پرت نمیشه)
'Cause with my arms around you, there's no need to care
چونکه با دستایی که تورو بغل کردن، دیگه نیازی به اهمیت دادن به اونا ندارم

[Pre-Chorus: Khalid]
We don't fit in well, we are just ourselves
خوب با همدیگه کنار نمیایم چونکه ما فقط خودمونیم
I could use some help gettin' out of this conversation, yeah
میتونستم یه ذره کمگ بگیرم که از این بحث و جدل بکشیم بیرون، آره
You look stunning, dear, so don't ask that question here
خیلی خوشگل شدی، عزیزم، پس دیگه اون سوالو اینجا نپرس
This is my only fear: that we become
تنها ترسم اینه که: بشیم مثل ....

[Chorus: Ed Sheeran]
Beautiful people
آدمای خوشگل
Drop top, designer clothes
با ماشینای بدون سقفشون، و لباسای مارک دارشون
Front row at fashion shows
توی ردیف جلویی نمایش مد (فشن شو) میشینن
""What d'you do?"" and ""Who d'you know?""
چی کار میکنی؟ و چی میدونی؟
Inside the world of beautiful people
توی دنیای آدمای خوشگل
Champagne and rolled-up notes
شامپاین میزنیم و پولای رول شده رو آماده میکنیم
Prenups and broken homes
توافقای قبل از ازدواج و زوج هایی که از همدیگه طلاق گرفتن
Surrounded, but still alone
کلی آدم دور و برمونه، اما هنوزم تنهایییم
Let's leave the party
بیا این پارتی رو ول کنیم بریم

[Post-Chorus: Ed Sheeran, Both, Khalid]
That's not who we are (We are, we are, we are)
این رفتار اون کسی که هستیم نیستش (ما هستیم، هستیم، هستیم)
We are not beautiful, yeah
ما خوشگل (پولدار) نیستیم
Yeah, that's not who we are (We are, we are, we are)
اره، این رفتار اون کسی که هستیم نیستش (ما هستیم، هستیم، هستیم)
We are not beautiful (Beautiful)
ما خوشگل (پولدار) نیستیم (خوشگل)

[Outro: Ed Sheeran]
We are, we are, we are
ما هستیم، هستیم، هستیم ...
We are not beautiful
ما خوشگل نیستیم","Edward Christopher ""Ed"" Sheeran (born 17 February 1991) is a singer songwriter currently signed under Atlantic (WMG). Sheeran was born in Halifax, West Yorkshire before moving to Framlingham, Suffolk. In his time in Suffolk, he was known to have flourished as a hidden talent when it came to music. He learned guitar at a very young age, and began writing songs during his time at Thomas Mills High School in Framlingham. By the time Sheeran had left school <a href=""https://www.last.fm/music/Ed+Sheeran"">Read more on Last.fm</a>"
5,Goodbyes (Feat. Young Thug),Post Malone,dfw rap,150,65,58,-4,11,18,175,45,7,94,"[Songtext zu „Post Malone - Goodbyes feat. Young Thug (Deutsche Übersetzung)“]

[Part 1: Post Malone]
Ich und Kurt glaubten an dasselbe, zu viel Lust ist Schmerz
Meine Freundin kränkt mich vergebens, ich jammer' nur
Sie muss etwas ändern, braucht etwas um runter zu kommen
Also scheiß auf alles heute Nacht
Und sag mir nicht, ich soll die Klappe halten
Wenn du weißt, dass du zu viel redest
Aber du hast gar nichts zu sagen (sagen)

[Hook: Post Malone]
Ich will dich aus meinem Kopf
Ich will dich aus meinem Schlafzimmer heute Nacht (Schlafzimmer)
Ich könnte dich niemals retten (dich retten)
Denn ich muss auch gerettet werden
Mir fällt es nicht einfach, tschüss zu sagen

[Part 2: Post Malone]
Wir sind beide gestört, aber zu sturr um uns zu ändern
Jetzt trinke ich wieder, 80 Proof in meinen Venen
Und meine Fingerspitzen verfärbt, schaue den Abgrund hinab
Leg dich heute Nacht nicht mit mir an
Sag, du brauchst dieses Herz, dann ist es dein (es ist dein)
Stellte sich heraus, dass es nicht das war, was du wolltest (wolltest)
Und wir ließen nicht los und verloren es
Jetzt bin ich verloren

[Hook: Post Malone]
Ich will dich aus meinem Kopf (Kopf)
Ich will dich aus meinem Schlafzimmer heute Nacht (Schlafzimmer)
Ich könnte dich niemals retten (dich retten)
Denn ich muss auch gerettet werden (auch gerettet werden)
Mir fällt es nicht einfach, tschüss zu sagen

[Part 3: Young Thug]
Ich will dich aus meinem Leben
Ich will dich heute Nacht zurück bei mir
Ich versuch' dich abzuschneiden, kein Messer
Ich will dich in Würfel schneiden
Meine Art zu argumentieren ist habgierig, doch ich habe dich durchschaut
Kannst du aufhören den Fernseher auszumachen? Ich schaue den Fight
Ich flute die Garage, blaue Diamanten, kein Hai
Du bist eine Barbie-Puppe, wie Nicki Minaj
Du brauchst kein'n Schlüssel, um zu fahren, dein Auto am Ladegerät
Ich will dich nur von der Seite sehen, die die sich von nichts stören lässt (yeah)
Und ich will, dass du niemals aus gehst (raus)
Ich verspreche dir, dass wenn sie es drauf anlegen, spielen meine Typen mit dir (spielen)
Ich ficke sie und der Tourbus fährt noch (fährt)
Yeah, yeah, yeah, yeah, yeah

[Hook: Post Malone]
Ich will dich aus meinem Kopf (Kopf)
Ich will dich aus meinem Schlafzimmer heute Nacht (Schlafzimmer)
Ich könnte dich niemals retten (dich retten)
Denn ich muss auch gerettet werden (auch gerettet werden)
Mir fällt es nicht einfach, tschüss zu sagen

[Outro: Post Malone & Young Thug]
Tschüss, tschüss, tschüss (tschüss, tschüss)
Tschüss, tschüss, tschüss (tschüss, tschüss)
(Yeah, yeah, yeah, yeah, yeah)
Tschüss, tschüss, tschüss (tschüss, tschüss, tschüss)
Mir fällt es nicht einfach tschüss zu sagen
Tschüss, tschüss, tschüss (tschüss, tschüss)
Tschüss, tschüss, tschüss (tschüss, tschüss)
Tschüss, tschüss, tschüss (tschüss, tschüss)
Mir fällt es nicht einfach, tschüss zu sagen","Austin Richard Post (born July 4, 1995), known professionally as Post Malone, is an American singer, rapper, songwriter, record producer, and guitarist. He first gained major recognition in February 2015, after the release of his debut single ""White Iverson"". In August 2015, Malone landed a record deal with Republic Records. On December 9, 2016, he released his debut studio album Stoney.

Following the success of his 2016 Stoney single Congratulations <a href=""https://www.last.fm/music/Post+Malone"">Read more on Last.fm</a>"
6,I Don't Care (with Justin Bieber),Ed Sheeran,pop,102,68,80,-5,9,84,220,9,4,84,"Ed Sheeran - I Don't Care (with Justin Bieber)
Logic - Icy (feat. Gucci Mane)
Avicii - Tough Love
Russ - Civil War
Mary J. Blige - Thriving (with Nas)
Ari Lennox - BMO
blink-182 - Blame It On My Youth
Mustard - 100 Bands (feat. Quavo, 21 Savage, Meek Mill & YG)
David Guetta - Stay (Don't Go Away) [feat. Raye]
Lil Keed - Proud Of Me (feat. Young Thug)
Gia Woods - One Big Party
Major Lazer - Can't Take It From Me (feat. Skip Marley)
SG Lewis - Flames (feat. Ruel)
Jhene Aiko - Triggered (freestyle)
Logic - COMMANDO (feat. G-Eazy)
Ciara - Beauty Marks
Ingrid Michaelson - Missing You
Barns Courtney - You And I
Madonna - Crave (with Swae Lee)
LIVVIA - Dizzy
James Bay - Bad
Smokepurpp - Walk On Water
Marlo - Soakin Wet
$uicideBoy$ - nothingleftnothingleft ($UICIDEBOY$ X TRAVIS BARKER)
Bene - Evil Spider
Leven Kali - 1 On 1
James Arthur - Falling like the Stars
Carly Rae Jepsen - Too Much
teamwork. - Afterhours
ZAYN - A Whole New World (End Title) - From ""Aladdin""
Skepta - Greaze Mode
jesse saint john - Alex's Song
AURORA - The River
Aazar - Diva (with Swae Lee & Tove Lo)
Dimitri Vegas & Like Mike - Best Friend's Ass (feat. Paris Hilton)
Stunna 4 Vegas - Ashley (feat. DaBaby)
Meghan Trainor - Badass Woman
Kim Petras - Blow It All
A$AP Ferg - Pups (feat. A$AP Rocky)
Denzel Curry - RICKY
OMB Bloodbath - My Body
Lunay - Soltera - Remix
CXLOE - Low Blow
John The Blind - Paranoid
Luke Combs - Beer Never Broke My Heart
Dinah Jane - Retrograde
gnash - i'm so sad
Quando Rondo - Imperfect Flower
Mac DeMarco - On The Square
Young Nudy - Shotta (feat. Megan Thee Stallion)
Whethan - Let Me Take You (feat. Jeremih)
Ambjaay - Uno
Mike Bahía - La Lá
Charly Bliss - Young Enough
ILOVEMAKONNEN - Drunk on Saturday
Elohim - braindead
R3HAB - Don’t Give Up On Me Now (with Julie Bergan)
Mozzy - Winning (feat. Lil Poppa)
Yung Pinch - Wink Emoji (feat. GASHI)
Juke Ross - Burned By The Love
83 Babies - No Cap (feat. Rich The Kid)
Grace Carter - Don't Hurt Like It Used To
girl in red - dead girl in the pool.
Jamila Woods - BALDWIN
Tee Grizzley - Locked Up
Calboy - Caroline (feat. Polo G)
Shaggy - Body Good (feat. Nicky Jam)
Sam Feldt - Magnets (feat. Sophie Simmons)
Gorgon City - Go Slow (with Kaskade)
Flying Lotus - More
SAFE - Red Light
Marc Anthony - Lo Que Te Di
MK - Body 2 Body
JAMESDAVIS - I Will
Isaac Dunbar - cologne
Phantom Planet - BALISONG
Jay Gwuapo - From Nothing (feat. Lil Tjay & Don Q)
Valentino Khan - Pony
mxmtoon - prom dress
Silversun Pickups - Freakazoid
Generationals - I Turned My Back on the Written Word
Raveena - Mama
FISHER - You Little Beauty
In Real Life - Somebody Like You
Lightshow - Your Side, My Side (feat. Wale)
Yoshi Flower - validation
Maxo Kream - She Live (feat. Megan Thee Stallion)
D Savage - WYTD
Vanic - Save Yourself
Dalex - Cuaderno
Shoreline Mafia - Vicious
Emotional Oranges - Good To Me
Moontower - Part 2
Vince Gill - A Letter To My Mama
Crumb - Ghostride
Jean Watts - Feel The Same
Eddington Again - Sweet
MEMBA - Walls Down
Dutch Melrose - White Wine","Edward Christopher ""Ed"" Sheeran (born 17 February 1991) is a singer songwriter currently signed under Atlantic (WMG). Sheeran was born in Halifax, West Yorkshire before moving to Framlingham, Suffolk. In his time in Suffolk, he was known to have flourished as a hidden talent when it came to music. He learned guitar at a very young age, and began writing songs during his time at Thomas Mills High School in Framlingham. By the time Sheeran had left school <a href=""https://www.last.fm/music/Ed+Sheeran"">Read more on Last.fm</a>"
