Unnamed: 0,Track.Name,Artist.Name,Genre,Beats.Per.Minute,Energy,Danceability,Loudness..dB..,Liveness,Valence.,Length.,Acousticness..,Speechiness.,Popularity,Track.Lyrics,Artist.Bio
29,Con Calma,Daddy Yankee,latin,94,86,74,-3,6,66,193,11,6,91,"[Letra de ""Con Calma"" ft. Snow]

[Intro: Daddy Yankee]
D-D-D-D-D-DY
Play N' Skillz
¡Run!

[Pre-Coro: Daddy Yankee]
¿Cómo te llamas, baby?
Desde que te vi supe que eras pa’ mí
Dile a tus amigas que andamo' ready
Esto lo seguimo' en el after party
¿Cómo te llamas, baby? (Brr, brr)
Desde que te vi supe que eras pa’ mí
Dile a tus amigas que andamo' ready (¡Sube!)
Esto lo seguimo' en el after party (Su-su, ey)

[Coro: Daddy Yankee]
Con calma, yo quiero ver como ella lo menea
Mueve ese poom-poom, girl
Es una asesina, cuando baila quiere que to' el mundo la vea
I like your poom-poom, girl (Sub-sube)
Con calma, yo quiero ver como ella lo menea
Mueve ese poom-poom, girl
Tiene adrenalina, en medio 'e la pista, vente, hazme lo que sea
I like your poom-poom, girl (¡Hey!)

[Verso 1: Daddy Yankee]
Ya vi que estás solita, acompáñame
La noche es de nosotro', tú lo sabe' (You know!)
Que ganas me dan-dan-dan
De guayarte, mami, ese ram-pam-pam, yeah
Esa criminal como lo mueve e' un delito (Oh)
Tengo que arrestarte porque empiezo y no me quito (Eh)
Tienes criminality, pero te doy fatality
Vívete la película flotando en mi gravity
Daddy pone las regla’, tiene’ que obedecer
Mami, no tiene pausa, ¿qué e' lo que vas a hacer?
Échale, échale, échale pa’ atrás
Échale, échale, pa' alante y pa' atrás (Eh, ey-ey-ey)

[Coro: Daddy Yankee]
Con calma, yo quiero ver como ella lo menea
Mueve ese poom-poom, girl (Girl)
Es una asesina, cuando baila quiere que to' el mundo la vea
I like your poom-poom, girl
Con calma, yo quiero ver como ella lo menea (Con calma)
Mueve ese poom-poom, girl
Tiene adrenalina, en medio ’e la pista, vente, hazme lo que sea
I like your poom-poom, girl

[Verso 2: Daddy Yankee]
Tú tiene' candela y yo tengo la vela
Llama el 911, se están quemando las suela'
Me daña cuando la faldita esa me la modela
Mami, 'tás enferma, pero tu show no lo cancela'
Te llaman a ti la reina del party
Mucha sandunga tiene ese body
Tírate un paso, no-no-no pare, ¡wow, dale, dale! (Yo')
Somos dos bandido' entre la rumba y romance
Y zúmbale, DJ, otra ve' pa' que dance
Échale, échale, échale pa' atrás
Échale, échale, pa' alante y pa' atrás (Ey, eh, ey)

[Coro: Daddy Yankee]
Con calma, yo quiero ver como ella lo menea (Con calma)
Mueve ese poom-poom, girl (Girl)
Es una asesina, cuando baila quiere que to' el mundo la vea
I like your poom-poom, girl
Con calma, yo quiero ver como ella lo menea (Con calma)
Mueve ese poom-poom, girl
Tiene adrenalina, en medio 'e la pista, vente, hazme lo que sea
I like your poom-poom, girl (¡Snow!)

[Verso 3: Snow & Daddy Yankee]
Come with a nice young lady (What?)
Intelligent, yes, she gentle and irie (¡Fuego!)
Everywhere me go me never lef' her at all-ie (¡Dile!)
Yes-a Daddy Snow me are the roam dance man-a (¡Snow!)
Roam between-a dancin' in-a in-a nation-a (Prr-prr-prr)
You never know say daddy me Snow me are the boom shakata (¿Qué-qué-qué-qué?)
Me never lay-a down flat in-a one cardboard box-a (¡Sube, sube!)
Yes-a Daddy Yankee me-a go reachin' out da top (What?)

[Coro: Daddy Yankee & Snow]
Con calma, yo quiero ver como ella lo menea
Mueve ese poom-poom, girl (Girl)
Es una asesina, cuando baila quiere que to' el mundo la vea
I like your poom-poom, girl
Con calma, ya' no say daddy me Snow me I go blame
I like your poom-poom, girl
'Tective man a say, say daddy me Snow me stop a girl down the lane
I love your poom-poom, girl","Ramón ""Raymond"" Luis Ayala Rodríguez (born February 3, 1977), known artistically as Daddy Yankee, is a Latin Grammy Award winning Puerto Rican reggaeton recording artist. Ayala was born in Río Piedras, the largest district of San Juan, Puerto Rico, where he became interested in music at a young age. In his youth he was interested in baseball, and aspired to become a Major League Baseball player. He was unable to continue this sport when he got shot in the leg by being mistaken for his friend by a unknown man <a href=""https://www.last.fm/music/Daddy+Yankee"">Read more on Last.fm</a>"
30,QUE PRETENDES,J Balvin,latin,93,79,64,-4,36,94,222,3,25,89,"[Letra de ""QUÉ PRETENDES""]

[Intro: J Balvin]
Uah, uh-uh
Uah
Yeah, yeah, yeah, yeah (Uh-uh)

[Pre-Coro: J Balvin]
Ahora quiere' volver (Ahora quieres volver, yeah)
Por qué razón, dime para qué (Para qué, para qué)
Ya no te presto atención (Ninguna)
Desde hace tiempo le puse punto final (Sí)

[Coro: J Balvin]
¿Qué pretendes tú llamándome a esta hora? (Yeah, hora)
Esa actitud la conozco ya (Yeah-yeah-yeah)
Sabes qué hacer muy bien para envolverme (Envolverme)
Pero esta vez es muy tarde ya (Uah, oh-oh-oh)

[Verso 1: Bad Bunny]
Estas no son horas de llamar (No)
Al meno' que me lo quiera' mamar
Que quiera' prender, que quiera' quemar (Uh-huh)
Hablando claro ya tú me cae' hasta mal (Ja)
Por ti me metí pastilla' y me fui de overflow Lamar (Woh)
Pero tú no ere' una Kardashian (No)
Contigo no me tiro, porque si no las retro se me embachan
De Snapchat te borré, de Facebook te borré
De Instagram te borré, de mi vida te borré (¡Plo!)

[Pre-Coro: Bad Bunny]
Y ahora quiere' volver (¡Nah!)
Nah, tú lo que quiere' e' joder (¡Wuh!)
Pero no se va a poder (Fuck you)
Me va' a ver con otra y te va' a morder (Uh)
Y ahora quiere' volver
Nah, tú lo que quiere' e' joder
Pero no se va a poder
Me va' a ver con otra y te va' a morder (¡Nah!)

[Coro: Bad Bunny]
¿Qué pretendes tú llamándome a esta hora? (Ey)
Esa actitud la conozco ya
Sabes qué hacer muy bien para envolverme
Pero esta vez es muy tarde ya
Yeah-yeah-yeah-yeah-yeah-yeah

[Verso 2: J Balvin]
Intentas hacerlo todo para que yo vuelva
Las cosas no son iguales, ¿para qué insistir?
Evita molestias y tu tiempo no pierdas
Conmigo no encuentras nada
A escondidas vives chequeando las fotos
Investigando mi perfil
No lo niegues, bien te conozco

[Puente: J Balvin]
Todo lo que tú hiciste conmigo
Quiere' repetirlo
Anda buscando más
Y a mí eso me da igual
Todo lo que tú hiciste conmigo
Quiere' repetirlo
Anda buscando más
Y a mí eso me da igual

[Coro: J Balvin & Bad Bunny]
¿Qué pretendes tú llamándome a esta hora? (Yeah, hora)
Esa actitud la conozco ya (Yeah-yeah-yeah)
Sabes qué hacer muy bien para envolverme (Envolverme)
Pero esta vez es muy tarde ya (Uah, oh-oh-oh)
¿Qué pretendes tú llamándome a esta hora? (Ey)
Esa actitud la conozco ya
Sabes qué hacer muy bien para envolverme
Pero esta vez es muy tarde ya
Yeah-yeah-yeah-yeah-yeah-yeah

[Outro:]
Sky Rompiendo
Yeah, yeah, yeah, yeah
Rompiendo el Bajo
Bad Bunny, baby-be-be-bebé-bebé, bebé
J Balvin
Leggo'
J Balvin
Bad Bunny
Oasis
Oasis, baby
Esta va pa' ti","José Álvaro Osorio Balvin (born May 7, 1985), known professionally as J Balvin, is a Colombian reggaeton singer. Balvin was born in Medellín, Colombia, where he became interested in music at a young age. At age 17, he moved to the United States and learned English, which influenced the music he would make later. He then returned to Medellín and gained local popularity by performing at various clubs around the city.

Though his music is primarily reggaeton <a href=""https://www.last.fm/music/J+Balvin"">Read more on Last.fm</a>"
31,Takeaway,The Chainsmokers,edm,85,51,29,-8,10,36,210,12,4,84,"[Intro: Lennon Stella]
Your heart for takeaway, yeah, yeah, yeah-yeah
Your heart for takeaway, yeah, yeah, yeah-yeah
Your heart for takeaway, yeah-yeah, yeah-yeah
Your heart for takeaway, yeah, yeah, yeah-yeah

[Verse 1: Lennon Stella & Andrew Taggart]
Hey, hey, hey
Where do you think you're going?
It's so late, late, late, what's wrong?
I said, ""I can't stay, do I have to give a reason?""
It's just me, me, me, it's what I want

[Pre-Chorus: Lennon Stella & Andrew Taggart]
So how did we get here?
Three weeks now, we've been so caught up
Better if we do this on our own

[Chorus: Lennon Stella & Andrew Taggart]
Before I love you, na, na, na
I'm gonna leave you, na, na, na
Before I'm someone you leave behind
I'll break your heart so you don't break mine
Before I love you, na, na, na
I'm gonna leave you, na, na, na
Even if I'm not here to stay
I still want your heart

[Post-Chorus: Lennon Stella]
Your heart for takeaway, yeah, yeah, yeah-yeah
Your heart for takeaway, yeah, yeah, yeah-yeah
Your heart for takeaway, yeah-yeah, yeah-yeah
Your heart for takeaway, yeah, yeah, yeah-yeah

[Drop]
Your heart for takeaway
(Your heart for takeaway, yeah-yeah, yeah-yeah)
Your heart for takeaway, yeah, yeah, yeah-yeah

[Verse 2: Lennon Stella & Andrew Taggart]
Fate, fate, fate
Is that what came between us?
Or did we do this on our own?

[Pre-Chorus: Lennon Stella & Andrew Taggart]
So how did we get here?
I'm asking myself why I'm so caught up
Better if we do this on our own

[Chorus: Lennon Stella & Andrew Taggart]
Before I love you, na, na, na
I'm gonna leave you, na, na, na
Before I'm someone you leave behind
I'll break your heart so you don't break mine
Before I love you, na, na, na
I'm gonna leave you, na, na, na
Even if I'm not here to stay
I still want your heart

[Post-Chorus: Lennon Stella]
Your heart for takeaway, yeah, yeah, yeah-yeah
Your heart for takeaway, yeah, yeah, yeah-yeah
Your heart for takeaway, yeah-yeah, yeah-yeah
Your heart for takeaway, yeah, yeah, yeah-yeah

[Drop]
Your heart for takeaway
(Your heart for takeaway, yeah-yeah, yeah-yeah)
Your heart for takeaway, yeah, yeah, yeah-yeah

[Chorus: Andrew Taggart]
Before I love you, na, na, na
I'm gonna leave you, na, na, na
Before I'm someone you leave behind
I'll break your heart so you don't break mine
Before I love you, na, na, na
I'm gonna leave you, na, na, na
Even if I'm not here to stay
I still want your heart","A production duo featuring Andrew Taggart and Alex Pall, the Chainsmokers mix indie, dance, and pop into a chart-topping sound that spawned hits like ""Roses,"" ""Closer,"" and ""Don't Let Me Down."" Pall and Taggart first made a name for themselves by creating remixes of their favorite indie bands that garnered tens of millions of streams. The duo released its official debut single, ""#Selfie,"" which celebrated and skewered 2010s narcissism, in January 2014. <a href=""https://www.last.fm/music/The+Chainsmokers"">Read more on Last.fm</a>"
32,7 rings,Ariana Grande,dance pop,140,32,78,-11,9,33,179,59,33,89,"[Verse 1]
Yeah, breakfast at Tiffany's and bottles of bubbles
Girls with tattoos who like getting in trouble
Lashes and diamonds, ATM machines
Buy myself all of my favorite things (Yeah)
Been through some bad shit, I should be a sad bitch
Who woulda thought it'd turn me to a savage?
Rather be tied up with calls and not strings
Write my own checks like I write what I sing, yeah (Yeah)

[Pre-Chorus]
My wrist, stop watchin', my neck is flossy
Make big deposits, my gloss is poppin'
You like my hair? Gee, thanks, just bought it
I see it, I like it, I want it, I got it (Yeah)

[Chorus]
I want it, I got it, I want it, I got it
I want it, I got it, I want it, I got it
You like my hair? Gee, thanks, just bought it
I see it, I like it, I want it, I got it (Yep)

[Verse 2]
Wearing a ring, but ain't gon' be no ""Mrs.""
Bought matching diamonds for six of my bitches
I'd rather spoil all my friends with my riches
Think retail therapy my new addiction
Whoever said money can't solve your problems
Must not have had enough money to solve 'em
They say, ""Which one?"" I say, ""Nah, I want all of 'em""
Happiness is the same price as red-bottoms

[Pre-Chorus]
My smile is beamin' (Yeah), my skin is gleamin' (Is gleamin')
The way it shine, I know you've seen it (You've seen it)
I bought a crib just for (Just for) the closet (Closet)
Both his and hers, I want it, I got it, yeah

[Chorus]
I want it, I got it, I want it, I got it
I want it, I got it, I want it, I got it (Baby)
You like my hair? Gee, thanks, just bought it (Oh yeah)
I see it, I like it, I want it, I got it (Yep)

[Verse 3]
Yeah, my receipts be lookin' like phone numbers
If it ain't money, then wrong number
Black card is my business card
The way it be settin' the tone for me
I don't mean to brag, but I be like, ""Put it in the bag,"" yeah
When you see them racks, they stacked up like my ass, yeah
Shoot, go from the store to the booth
Make it all back in one loop, gimme the loot
Never mind, I got the juice
Nothing but net when we shoot
Look at my neck, look at my jet
Ain't got enough money to pay me respect
Ain't no budget when I'm on the set
If I like it, then that's what I get, yeah

[Chorus]
I want it, I got it, I want it, I got it (Oh yeah)
I want it, I got it, I want it, I got it (Oh yeah, yeah)
You like my hair? Gee, thanks, just bought it
I see it, I like it, I want it, I got it (I see, yep)","Ariana Grande is an American singer, songwriter, and actress. A multi-platinum, Grammy Award-winning recording artist. Born in Boca Raton, Florida, Grande began her career in 2008 in the Broadway musical, 13. She rose to prominence for her role as Cat Valentine in the Nickelodeon television series, Victorious (2010–2013) and in its spin-off, Sam & Cat (2013–2014). As she grew interested in pursuing a music career, Grande recorded songs for the <a href=""https://www.last.fm/music/Ariana+Grande"">Read more on Last.fm</a>"
33,0.958333333333333,Maluma,reggaeton,96,71,78,-5,9,68,176,22,28,89,,"Juan Luis Londoño Arias (Born January 28, 1994, Medellín, Colombia), is a singer of Colombian nationality. He began his musical career at an early age in his hometown of Medellín, there has developed an established career in Latin America, becoming nominated for several awards from major musical relevance.

Prior to serving as a singer, Maluma started in football, a sport he practiced for eight years in a row, reaching the lower divisions of the equipment Atlético Nacional and La Equidad. <a href=""https://www.last.fm/music/Maluma"">Read more on Last.fm</a>"
34,The London (feat. J. Cole & Travis Scott),Young Thug,atl hip hop,98,59,80,-7,13,18,200,2,15,89,"[Intro: J. Cole]
Yeah, yeah, yeah
Oh, oh, woah
Woah, woah
Oh
(You good, T-Minus?)
Oh

[Chorus: Travis Scott]
Me-meet me at The London
If you find time, we can run one
Talk about some things we can't undo
You just send the pin, I can find you
6'1"", on the money, 9'2""
You just say the word and I'll run through
Two texts, no reply, that's when I knew
I knew, I knew, yeah, I knew

[Verse 1: J. Cole]
Yeah, circumnavigate the globe as the cash grows (Grow)
Get a nigga whacked like you get the grass mowed (Mowed)
I'm talkin' slick when I'm with the Big Slime, nigga (Slime)
Could hit your bitch, you could never hit mine, nigga (Mine)
In my DM, they electric slide, nigga (Huh, slide)
No catfishin', this is not a fish fry, nigga
Never switch sides on my dog
Catch a contact, hitch a ride, go to Mars
Everybody sing
How could you come up out your face
And say I ain't the hardest nigga you done ever heard?
I left a flock of rappers dead and buried
A verse from me is like eleven birds
Just did the math, that's like two thousand dollars every word
I'm on the verge, I'll beat the charge
I killed some niggas and I walked away from it
Then I observe, just how you curve
Then told the nigga that they gotta wait for it
""I know—I know you in high demand""
I'm ballin' on a pussy nigga like Juwanna Mann
I'm drownin' all inside the pussy like I never swam
Ayy, fuck your IG, I put somethin' on your sonogram
I'm the man, ayy, ayy

[Chorus: Travis Scott]
Me-meet me at The London
If you find time, we can run one
Talk about some things we can't undo
You just send the pin, I can find you
6'1"", on the money, 9'2""
You just say the word and I'll run through
Two texts, no reply, that's when I knew
I knew, I knew, yeah, I knew

[Verse 2: Young Thug]
Pimp talk, church talk, I can make a brick walk (Woo)
Up north, down south, Bankhead to Rachel Walk (Ayy)
Hit it with a little water, stretch it like a vocal cord
STD, I run my ward, fuck a fed and his daughter (Let's go)
I'ma run the compound (Yeah)
I supply the cigarettes and bread (Woo)
I got a main and she gon' ride (Uh-huh)
She took a quarter and she fled (Uh)
I'm in the Lamb', so she gon' ride (Yeah)
I see the pain in shawty's light brown eyes (Ooh)
I'm at The London with some big thots
No fries, she eat steaks with the fish sides
Didn't your mama tell you when something on fire, stop, drop and roll? (Aw yeah)
I've been on the road like a pair of spinners at Stop-N-Go's (Yeah)
I could charge 'em like a Dodge Hemi Demon
Got your broad in the garage eatin' semen
Every time a nigga go back to the ward
Niggas act like they want start
And we leave them on the cement (Grra, grra)

[Chorus: Travis Scott]
Me-meet me at The London
If you find time, we can run one
Talk about some things we can't undo
You just send the pin, I can find you
6'1"", on the money, 9'2""
You just say the word and I'll run through
Two texts, no reply, that's when I knew
I knew, I knew, yeah, I knew

[Outro: Travis Scott]
I, crash down, we get money (Hey)
For the full town (Woah, when you won't play, I)
I decided, for the full side (Hoes will say)
And they know, I might (And fly, I...)
Get down, might (Don't play)
See the whole town every time, I... (Oh, every day)
Yeah, they know what's up (Folks will say)","Jeffery Williams, better known by his stage name Young Thug (also uses the name ""SEX!!"" and was briefly known as ""Jeffery""), is an American rapper from Atlanta, Georgia who is signed to Gucci Mane's 1017 Brick Squad Records, Asylum Records and Atlantic Records. Thug grew to prominence in 2013 after releasing his mixtape 1017 Thug to positive critical reception. He has collaborated with artists such as Gucci Mane, Young Scooter, Rich Homie Quan and Waka Flocka Flame. <a href=""https://www.last.fm/music/Young+Thug"">Read more on Last.fm</a>"
35,Never Really Over,Katy Perry,dance pop,100,88,77,-5,32,39,224,19,6,89,"[Verse 1]
I'm losing my self control
Yeah, you’re starting to trickle back in
But I don't wanna fall down the rabbit hole
Cross my heart, I won't do it again

[Pre-Chorus]
I tell myself, tell myself, tell myself, ""Draw the line""
And I do, I do
But once in a while, I trip up, and I cross the line
And I think of you

[Chorus]
Two years, and just like that
My head still takes me back
Thought it was done, but I
Guess it’s never really over
Oh, we were such a mess
But wasn't it the best?
Thought it was done, but I
Guess it's never really over

[Post-Chorus]
Just because it's over doesn't mean it's really over
And if I think it over, maybe you'll be coming over again
And I'll have to get over you all over again
Just because it’s over doesn’t mean it's really over
And if I think it over, maybe you’ll be coming over again
And I'll have to get over you all over again

[Verse 2]
I guess I could try hypnotherapy
I gotta rewire this brain
'Cause I can't even go on the internet
Without even checking your name

[Pre-Chorus]
I tell myself, tell myself, tell myself, ""Draw the line""
And I do, I do
But once in a while, I trip up, and I cross the line
I think of you

[Chorus]
Two years, and just like that
My head still takes me back
Thought it was done, but I
Guess it’s never really over
Oh, we were such a mess
But wasn't it the best?
Thought it was done, but I
Guess it's never really over

[Post-Chorus]
Just because it's over doesn't mean it's really over
And if I think it over, maybe you'll be coming over again
And I'll have to get over you all over again
Just because it's over doesn't mean it's really over
And if I think it over, maybe you'll be coming over again
And I'll have to get over you all over again

[Bridge]
Thought we kissed goodbye
Thought we meant this time was the last
But I guess it's never really over
Thought we drew the line right through you and I
Can't keep going back
I guess it's never really over, yeah

[Chorus]
Two years, and just like that
My head still takes me back
Thought it was done, but I
Guess it's never really over

[Post-Chorus]
Just because it's over doesn't mean it's really over
And if I think it over, maybe you'll be coming over again
And I'll have to get over you all over again
(And I'll have to get over you all over again)
Just because it's over doesn't mean it's really over
And if I think it over, maybe you'll be coming over again
And I'll have to get over you all over again
(Over you all over again)

[Outro]
Thought we kissed goodbye
Thought we meant this time was the last
But I guess it's never really over
Thought we drew the line right through you and I
Can't keep going back
I guess it's never really over","Katy Perry (born Katheryn Elizabeth Hudson, October 25, 1984) is a singer/songwriter from Santa Barbara, California, United States. Perry's success was so sudden in 2008 it seemed as if she was an overnight success when the opposite was true. Daughter of Pentecostal pastors, Katy was raised by born-again parents and was initially attracted to gospel music, sometimes sneaking pop music in to balance the inspirational tunes, but when she first started singing it was in the church. <a href=""https://www.last.fm/music/Katy+Perry"">Read more on Last.fm</a>"
36,Summer Days (feat. Macklemore & Patrick Stump of Fall Out Boy),Martin Garrix,big room,114,72,66,-7,14,32,164,18,6,89,"Taylor Swift - ME! (feat. Brendon Urie of Panic! At The Disco)
Lauv - Drugs & The Internet
Marshmello - Light It Up (with Tyga & Chris Brown)
ScHoolboy Q - Floating (feat. 21 Savage)
P!nk - Hurts 2B Human (feat. Khalid)
DJ Snake - Enzo (with Sheck Wes, feat. Offset, 21 Savage & Gucci Mane)
FLETCHER - If You're Gonna Lie
Martin Garrix - Summer Days (feat. Macklemore & Patrick Stump of Fall Out Boy)
Carlie Hanson - Back in My Arms
Russ - All I Want
YG - Stop Snitchin
FKA twigs - Cellophane
Alessia Cara - I'm Like A Bird - Recorded at Spotify Studios NYC
Kevin Abstract - Peach
Florence + The Machine - Jenny of Oldstones (Game of Thrones)
Zara Larsson - WOW
Kim Petras - Broken
Willie Jones - Down For It
A$AP Rocky - Too Many Gods (feat. Joey Bada$$)
blackbear - CHANGES
The Chainsmokers - Do You Mean
Farruko - La Cartera
LANY - okay
The Black Keys - Eagle Birds
King Henry - Let You Know
Beyoncé - Sorry - Original Demo
James Blake - Mulholland
Young Nudy - Mister (feat. 21 Savage)
Kenny Beats - Again
Vory - Save Me Now
Bebe Rexha - Girl in the Mirror
Pitbull - No Lo Trates
Diplo - So Long (feat. Cam)
BabyJake - Cigarettes On Patios
Flying Lotus - Spontaneous
Catfish and the Bottlemen - Encore
Sum 41 - Out For Blood
Bastille - Doom Days
SK8 - Mood (feat. YK Osiris)
Sean Kingston - Peace of Mind
Quinn Lewis - Only Everything
PRETTYMUCH - Phases
EDX - Off The Grid
Sandro Cavazza - Enemy
DREAMERS - DIZZY
99 Neighbors - welcome to chili's
Stormzy - Vossi Bop
MAJ - Come Here
Palmistry - Rovin
Jay Gwuapo - Oh No (feat. Calboy)
James TW - Incredible
BJ The Chicago Kid - Time Today
Better Oblivion Community Center - Little Trouble
NIKI - lowkey
SHY Martin - Out of My Hands
OTR - Heart
Shae Jacobs - How To Be Friends
Alexander 23 - When I Die
Winnetka Bowling League - Diane
Emotional Oranges - Someone Else
EDEN - 909
Olivia O'Brien - Call Me!!!
Don Diablo - Brave
Local Natives - Megaton Mile
Bruce Springsteen - Hello Sunshine
Maddie & Tae - One Heart To Another
Kevin Morby - Hail Mary
ROMderful - Catch Me?
Lucky Daye - Love You Too Much
Terror Jr - Loved By You
Slushii - Dreaming of You
Jakob Ogawa - All I Wanna Do
Barrie - Geology
Mr. Popular - Poison
Digital Farm Animals - Next To You (feat. Rvssian)
Luis Fonsi - Date La Vuelta
Gavin Haley - 96
Billy Raffoul - Running Wild
Party Favor - Wait A Minute
FRENSHIP - Keep You Close
Lucy Dacus - My Mother & I
AJR - Don't Throw Out My Legos
Aldous Harding - Treasure
Birdman - Cap Talk
Chaz French - Handful
MARINA - Life Is Strange
Rob Thomas - We Were Beautiful
Josh Ritter - Blazing Highway Home
Zigmeister - Zombie Luv
A-Trak - Work It Out
Nick Murphy - Dangerous
Winona Oak - He Don't Love Me
Rymez - Don Walk
Grace Ives - Lucky
Breathe Carolina - All I Need
TWICE - FANCY
Wilkinson - All For You
SOAK - Maybe
Maude Latour - Superfruit
Esperanza Spalding - Lest We Forget (blood)","Martijn Gerard Garritsen, born on the 14th May 1996 is a Dutch musician and producer from Amstelveen. He was named the DJ Mag top DJ in the world for 2016 and 2017. He has also had a number of high profile artists residencies, including at Hï Ibiza and OMNIA Nightclub.

In 2012, Garritsen signed a professional contract with Spinnin' Records until terminating his contract in 2015 and cutting ties with his management, MusicalAllStars on August 25, 2015. <a href=""https://www.last.fm/music/Martin+Garrix"">Read more on Last.fm</a>"
