Unnamed: 0,Track.Name,Artist.Name,Genre,Beats.Per.Minute,Energy,Danceability,Loudness..dB..,Liveness,Valence.,Length.,Acousticness..,Speechiness.,Popularity,Track.Lyrics,Artist.Bio
16,No Guidance (feat. Drake),Chris Brown,dance pop,93,45,70,-7,16,14,261,12,15,82,"[Intro: Che Ecru & Drake]
Before I die I'm tryna fuck you, baby
قبل اینکه بمیرم میخوام بکنمت عزیزم
Hopefully we don't have no babies
خداروشکر بچه مچه ام نداریم
I don't even wanna go back home
حتی نمیخوام از کنارت پاشم برم خونم
Hopefully, I don't leave you on your own
خوشبختانه نمیخوام به حال خودت ولت کنم

[Verse 1: Drake]
Ayy
اییی
Trips that you plan for the next whole week
اون پیک نیک و سفرایی که برای کل هفته ی بعد واسشون برنامه میریزی
Bands too long for a nigga so cheap
هزار دلار پول خیلی زیادیه واس یه کاکاسیاهه بدبخت و بی پول
And your flex OD, and your sex OD
و پز دادنات زیادی از حده، و دیگه خیلی داری کون میدی (سکس میکنی)
You got it, girl, you got it (Ayy)
میفهمی چی میگم عزیزم، میفهمی
You got it, girl, you got (Yeah)
میفهمی چی میگم عزیزم، میفهمی
Pretty lil' thing, you got a bag and now you wildin'
خیلی چیز جمع و جوری هستی، یه کیف رو دوشت داری و الان داری کس کلک بازی در میاری
You just took it off the lot, no mileage
فقط کنترلتو جلو کلی ادم از دست دادی، چونکه کسی رو نداشتی که کونت بزاره
Way they hittin' you, the DM lookin' violent
انگار خیلی باهات سکس میکنن (کونت میزارن) آخه دایرکت مسیجات خشن به نظر میان
Talkin' wild, you come around and now they silent
خیلی خشن حرف میزنی، وقتی میای دور برشون همشون خفه خون میگیرن
Flew the coop at 17, no guidance
وقتی 17 سالم بود از خونمون زدم بیردن و رفتم، هیچکی راهنماییم نکرد
You be stayin' low but you know what the vibes is
داری اینو مخفیش میکنی ولی خوب میدونی این چطور احساسیه
Ain't never got you nowhere bein' modest
هیچوقت هیچ جا تورو ندیدم که با حیا باشی
Poppin' shit but only 'cause you know you'repoppin', yeah
کسشعر عاشقانه تفت میدم (باهات کل کل میکنم) فقط بخاطر اینکه توام داری اینکارو میکنی، آره

[Chorus: Drake]
You got it, girl, you got it (Ayy)
میفهمی چی میگم عزیزم، میفهمی
You got it, girl, you got it
میفهمی چی میگم عزیزم، میفهمی

[Verse 2: Chris Brown]
Lil' baby in her bag, in her Birkin
دختر کوچولو موچولوعه سرش تو کیفشه، داخل کیف ""برکینش""
No nine to five, put the work in
و از ساعت 9 صبح تا 5 بعد از ظهر قرار نیست بره سر کار
Flaws and all, I love 'em all, to me, you're perfect
علی رغم همه ی سختی هاش، عاشقشم، به نظرم، تو فوق العاده ای دختر
Baby girl, you got it, girl, you got it, girl (Oh-oh)
عزیزم عشقم، میفهمی چی میگم، عزیزم، میفهمی چی میگم
You got it, girl, you got it, girl (Ooh)
میفهمی عزیزم، میفهمی چی میگم

[Pre-Chorus: Chris Brown]
I don't wanna play no games, play no games
نمیخوام بچه بازی درارم، نمیخوام بازی درارم
Fuck around, give you my last name (Oh)
کس چرخ میزنم، و بهت فامیلیمو میگم
Know you tired of the same damn thing
میدونم که از همون چیزای همیشگی (تکراری) خسته شدی
That's okay 'cause, baby, you
اشکالی نداره چونکه عزیزم تو ...

[Chorus: Drake, Chris Brown & Both]
You got it, girl, you got it (Oh, ooh, ayy)
میفهمی چی میگم عزیزم، میفهمی چی میگم
You got it, girl, you got it (Got it)
میفهمی چی میگم عزیزم، میفهمی چی میگم

[Verse 3: Chris Brown]
You the only one I'm tryna make love to, pickin' and choosin'
تو تنها کسی هستی که میخوام عشق و علاقمو بریزم به پاش، گلچینت میکنم و انتخابت میکنم
They ain't really love you, runnin' games, usin'
اونا واقعا تورو دوست ندارن، بازیت میدن و ازت استفاده میکنن
All your stupid exes, they gon' call again
همه اون دوست پسرای سابق کسخلت، بهت دوباره زنگ میزنن
Tell 'em that a real nigga steppin' in
بهشون بگو که یه کاکاسیاه واقعی کمک حالم شده
Don't let them niggas try you, test your patience
به اون کاکاسیاها اجازه نده امتحانت کنن، یا صبر و تحملت رو ازمایش کنن
Tell 'em that it's over, ain't no debatin' (Uh)
بهشون بگو که همه چی تموم شده رفته، دیگه قرار گذاشتن بسه
All you need is me playin' on your playlist
تموم چیزی که لازم داری اینه که آهنگای من توی پلی لیستت پخش بشن
You ain't gotta be frustrated
دیگه لازم نیست نگران باشی

[Pre-Chorus: Chris Brown]
I don't wanna play no games, play no games
نمیخوام بچه بازی درارم، نمیخوام بازی درارم
Fuck around, give you my last name (Oh)
کس چرخ میزنم، و بهت فامیلیمو میگم
Know you tired of the same damn thing
میدونم که از همون چیزای همیشگی (تکراری) خسته شدی
That's okay 'cause, baby, you
اشکالی نداره چونکه عزیزم تو ...


[Chorus: Drake, Chris Brown & Both]
You got it, girl, you got it (Oh, ooh, ayy)
میفهمی چی میگم عزیزم، میفهمی
You got it, girl, you got it (Got it)
میفهمی چی میگم عزیزم، میفهمی
I don't wanna
نمیخوام ....

[Post-Chorus: Chris Brown & Che Ecru]
Before I die I'm tryna fuck you, baby
قبل اینکه بمیرم میخوام بکنمت عزیزم
Hopefully we don't have no babies
خداروشکر بچه مچه ام نداریم
I don't even wanna go back home
حتی نمیخوام از کنارت پاشم برم خونم
Hopefully, I don't leave you on your own
خوشبختانه نمیخوام به حال خودت ولت کنم
You got it, girl, you got it, oh
میفهمی چی میگم عزیزم، میفهمی چی میگم

[Verse 4: Drake & Chris Brown]
Play no games (No)
بازی برات در نمیارم
Freaky (Freaky)
خیلی عجیب غریبی (عجیب)
I can learn a lot from you, gotta come teach me (Woo, woo)
میتونم خیلی چیزا ازت یاد بگیرم، باید بیایو بهم درس بدی
You a lil' hot girl, you a lil' sweetie (No, sweet)
یه خرده سکسی هستی عزیزم، خیلی جذابی
Sweet like Pearland, sweet like Peachtree (Like that)
باحالی مثل ""پیر لند""، خوشگلی مثل ""پیچتیری""
I can tell you crazy, but shit kind of intrigue me (No, yeah, I like that)
میتونم بهت بگم کسخلی، ولی یه چیزیت خیلی منو به وجد میاره
(I don't wanna, I don't wanna)
نمیخوام، نمیخوام
Seen it on the 'gram, I'm tryna see that shit in 3D, mami
داخل اینستا دیدمش، میخوام اون کوفتی رو با عینک 3 بعدی ببینم، سکسی خانم
I know I get around 'cause I like to move freely
میدونم خیلی کس چرخ میزنم خیلی دوست دارم ازادانه حرکت کنم
But you could lock it down, I could tell by how you treat me
ولی میتونستی مخشو بزنی، منم میتونم برم بهش بگم که تو چطور با من رفتار میکنی
I seen how you did homeboy, so please take it easy (No, yeah)
دیدم که چطوری اینکارو انجامش میدی رفیق صمیمی، پس توروخدا جدیش نگیر
Good to have me on your side, I ain't sayin' that you need me (Yeah, yeah)
خیلی برات خوبه که من کنارت باشم، این حرفو نمیزنم که تو بهم نیاز داری
Six God talk but I ain't tryna get preachy (No, no, no)
سیکس گاد داره این حرفو میزنه ولی نمیخوام کسی واسم بره رو ممبرو نصیحتم کنه
I seen how you did homeboy, please take it easier on me
دیدم چطوری اونکارو میکنی رفیق، توروخدا واس من زیاد جدیش نگیر
'Cause I don't wanna (No) play no games, play no games
چونکه نمیخوام بازی درارم، بازی کنم
(I don't wanna, I don't wanna)
نمیخوام، نمیخوام
I don't wanna play no games, play no games
نمیخوام بازی درارم، بازی کنم
(I don't, I don't)
نمیخوام، نمیخوام

[Outro: Chris Brown]
I don't, I don't
نمیخوام، نمیخوام
No
نه","There is more than one artist with this name:

1) Christopher Maurice Brown (born May 5, 1989) from Tappahannock, Virginia.

In late 2005, he released his first studio album, Chris Brown, which spawned the Billboard Hot 100 number-one debut single, ""Run It!"" which was produced by Scott Storch and featured Juelz Santana. The album also produced two other top ten singles: ""Yo (Excuse Me Miss)"" and ""Say Goodbye."" Brown's second studio album, Exclusive was released worldwide in November 2007. <a href=""https://www.last.fm/music/Chris+Brown"">Read more on Last.fm</a>"
17,LA CANCIÓN,J Balvin,latin,176,65,75,-6,11,43,243,15,32,90,"[Letra de ""LA CANCIÓN""]

[Intro: Bad Bunny]
Yeh, yeh, yeh

[Estribillo: Bad Bunny]
Pensaba que te había olvida'o, eh
Pero pusieron la canción, eh, eh, eh
Que cantamo’ bien borracho'
Que bailamo' bien borracho’
Nos besamo' bien borracho' los dos
Pensaba que te había olvida'o, eh
Pero pusieron la canción, eh, eh, eh
Que cantamo' bien borracho'
Que bailamo' bien borracho'
Nos besamo’ bien borracho’ los dos
Pensaba que te había olvida'o

[Verso 1: J Balvin]
Justo cuando creía
Que por comerme a do’ o diez, te olvidaría' (Yeh)
Cogí un respiro y me salí de la vía
Y como un pendejo, no sabía lo que hacía
Nunca lo superé, nunca te superé (No; no)
Hasta me aprendí to'a la' balada’ en inglé' (Yeh)
Respiré y conté hasta tres (Uno, dos, tres)
Ere' la fantasía oscura de Kanye West, bebé, ey
Hace tiempo lo barato me salió caro (Yih)
Yo sólo twitteo, bala' loca' disparo (Yih)
¿Cómo olvidar la bellaquera en el carro?
¿A que guió solo?

[Estribillo: J Balvin & Bad Bunny]
Pensaba que te había' olvida'o (Pero no), yeh
Pero pusieron la canción, yeh, yeh
Que cantamos bien borrachos
Que bailamo' bien borrachos
Nos besamo' bien borracho' lo' dos
Pensaba que te había' olvida'o, eh
Pero pusieron la canción, yeh, yeh
Que cantamo' bien borracho'
Que bailamo' bien borracho'
Nos besamo' bien borracho' los dos, ey, ey

[Verso 2: Bad Bunny]
Y hace tiempo que no venía' a mi cabeza
Pero ya van par de cerveza'
Y me acordé de cómo tú me besa'
De to' lo' polvo' encima 'e la mesa
Y en el carro, la playa, y el motel
En casa de tu pai', cuando yo te iba a ver
Las vece' que tu mai' no' llegó a coger
Tú brincando mojaíta', sudando Chanel
Yo sé que lo nuestro e' cosa de ayer
Y me pone contento que te va bien con él
Yo ni te extrañaba ni te quería ver
Pero pusieron la canción que te gustaba poner
Y me acordé de ti, cuando me hiciste feliz
Se acabó, pues, me fui, ey
Yo mismo me río de mí porque—

[Estribillo: J Balvin]
Pensaba que te había' olvida'o, eh
Pero pusieron la canción, yeh, yeh
Que cantamos bien borrachos
Que bailamo' bien borrachos
Nos besamo' bien borracho' lo' do'

[Interludio Instrumental]

[Outro: Bad Bunny & J Balvin]
Y yo pensaba que tu nombre estaba muerto, eh
Pero te soñé despierto, ey
Hoy salí pa' la calle suelto
Sin sentimiento', el corazón desierto
Y yo pensaba que tu nombre estaba muerto
Pero te soñé despierto
Hoy salí pa' la calle sueltoSin sentimiento', el corazón desierto","José Álvaro Osorio Balvin (born May 7, 1985), known professionally as J Balvin, is a Colombian reggaeton singer. Balvin was born in Medellín, Colombia, where he became interested in music at a young age. At age 17, he moved to the United States and learned English, which influenced the music he would make later. He then returned to Medellín and gained local popularity by performing at various clubs around the city.

Though his music is primarily reggaeton <a href=""https://www.last.fm/music/J+Balvin"">Read more on Last.fm</a>"
18,Sunflower - Spider-Man: Into the Spider-Verse,Post Malone,dfw rap,90,48,76,-6,7,91,158,56,5,91,"Author: Jorge Ramos
You did read it, and it will happen. Post Malone has recently joined the exclusive list of artists to perform on Virtual Reality. The concert, scheduled for 17 of October will take place on the Raleigh’s PNC Arena, and streamed through the Oculus Venue app. So everyone who owns an Oculus headset will be able to watch the concert on a 180 perspective through Oculus Venues.

Post Malone is ready to “Bend Minds”, according to Billboard, and they are not wrong, the concert is going to be one of the increasing amounts of events to be streamed on VR this year, through the Oculus Venue app.

The Raleigh’s PNC Arena, in North Carolina, will hold the event that will be streamed in a 180 degrees perspective through Oculus Venue, an app of the VR company to watch exclusive events through Oculus devices.

The Grammy-winning artist dropped his most recent album, Hollywood’s Bleeding, back in September with some great collaborators, such as Ozzy Osborne and Travis Scott in the track “Take What You Want”, and Halsey alongside Future for “Die For Me”. The record also includes the singles “Wow” and “Sunflower” (Spiderman: Into the Spider-Verse) featuring Swae Lee, both reaching the top 10 of the Global Chart on Spotify.

Malone talked about the concert and according to Variety stated that “When putting together this tour, I wanted to make sure I was giving my fans something new and crazy with this new production and show.“ Later adding that “Working with Oculus on this VR broadcast gives fans at home a chance to sit front row with me during my North Carolina show, just like you’re in the arena. That sounds pretty f***ing cool to me.”

PREVIOUS CONCERTS BROADCASTED ON VR
The concert will make Austin Richard Post Aka Post Malone, one of the few people to have done this kind of show. Still, among important artists who have done it before there are Billie Eilish, who did it a month ago, and Tenacious D.

Tenacious D went out to do it on July 31st and many agree saying that it was a success and that the experience actually made it more comfortable. An unexpected advantage of “different state legislation” for some people, as it is mentioned in this article from The Cult Machine.
Moving a little closer on time, on September 3rd, we were able to see Billie Eilish’s concert being streamed on VR, using Oculus Venues as the platform as well. Eilish played in Madrid, Spain, and according to many articles, the experience and opinions may vary a lot, as it is explained in this article from the UploadVR.

According to iHeartRadio, she talked about the concert stating that ""I make everybody get really low, and we all jump when the drop comes in. Even though you'll be watching on a VR headset, you should still get low and jump with everyone.""

Besides music, there’s a lot of exclusive events that plan on going towards Virtual Reality, including the NBA. Last September they announced their collaboration with many VR platform to broadcast about 26 games starting this October. It is likely that soon you can watch the NFL season and bet on the Superbowl favorites, using VR technology.

VR HAS TAKEN OVER THE LAST YEAR
Although the recent concerts of some of the biggest stars of the moment have made VR reach a spotlight, there are a couple of extra apps that have taken a step forward on this remark. They are having thesigning deals with some of the biggest record labels and allowing us to feel we are on the crowds of different concerts, events or even festivals.

It is safe to say that Virtual Reality keeps breaking walls but is also worth to think for a minute how this could affect the trends, the attendances to concerts and many other factors. Also, what could change into the VR Apps for this kind of shows, if microtransactions are a possibility or any possible alteration in the near future.","Austin Richard Post (born July 4, 1995), known professionally as Post Malone, is an American singer, rapper, songwriter, record producer, and guitarist. He first gained major recognition in February 2015, after the release of his debut single ""White Iverson"". In August 2015, Malone landed a record deal with Republic Records. On December 9, 2016, he released his debut studio album Stoney.

Following the success of his 2016 Stoney single Congratulations <a href=""https://www.last.fm/music/Post+Malone"">Read more on Last.fm</a>"
19,Lalala,Y2K,canadian hip hop,130,39,84,-8,14,50,161,18,8,88,"[Intro: bbno$ & Y2K]
Did I really just forget that melody?
Naw, nana, bananana, nanananananana (Nana, ah-ah)
Alright, dada, dadadada

[Chorus: bbno$]
When I popped off then your girl gave me just a little bit of lockjaw
Baby so cold, he from the north, he from the Canada
Bankroll so low, I got nothing else that I can withdraw
Ran out the door
I shine my wrist, it go like shashasha, shashasha
I got your bitch singing, lalalala, lalala
I shine my wrist, it go like shashasha, shashasha
I got your bitch singing, lalalala, lalala
(How I stride like that)

[Verse 1: bbno$]
Amex, no cap, eight hundred score
They wonder how (How I guap like that)
I rap my lyrics when I perform
They wonder how (How I stride like that)
Married to the grind, I brought my ring
I'm corny, but your girly want the dick
Modest with my jewels, but check the bank
Finally got the money, say my thanks

[Chorus: bbno$]
When I popped off then your girl gave me just a little bit of lockjaw
Baby so cold, he from the north, he from the Canada
Bankroll so low, I got nothing else that I can withdraw
Ran out the door
I shine my wrist, it go like shashasha, shashasha
I got your bitch singing, lalalala, lalala
I shine my wrist, it go like shashasha, shashasha
I got your bitch singing, lalalala, lalala
(How I stride like that)

[Verse 2: bbno$]
Haha, I'm at the bank again
They wonder how (How I guap like that)
Pink whip with flames all on the side
They wonder how (How I stride like that)
Got that Gucci on my body, now she tryna pipe me, woo
Popped a Lucy, loosey-goosey, sussy boy, I keep you cool
Got the paper, went to school
Be careful who you callin' fool, ayy, ha, ayy

[Chorus: bbno$]
When I popped off then your girl gave me just a little bit of lockjaw
Baby so cold, he from the north, he from the Canada
Bankroll so low, I got nothing else that I can withdraw
Ran out the door
I shine my wrist, it go like shashasha, shashasha
I got your bitch singing, lalalala, lalala
I shine my wrist, it go like shashasha, shashasha
I got your bitch singing, lalalala, lalala
(How I stride like that)","<a href=""https://www.last.fm/music/Y2K"">Read more on Last.fm</a>"
20,Truth Hurts,Lizzo,escape room,158,62,72,-3,12,41,173,11,11,91,"[Intro]
Why men great 'til they gotta be great?
Woo!

[Verse 1]
I just took a DNA test, turns out I'm 100% that bitch
Even when I'm crying crazy
Yeah, I got boy problems, that's the human in me
Bling bling, then I solve 'em, that's the goddess in me
You coulda had a bad bitch, non-committal
Help you with your career just a little
You're 'posed to hold me down, but you're holding me back
And that's the sound of me not calling you back

[Chorus]
Why men great 'til they gotta be great? ('Til they gotta be great)
Don't text me, tell it straight to my face (Tell it straight to my face)
Best friend sat me down in the salon chair (Down in the salon chair)
Shampoo press, get you out of my hair
Fresh photos with the bomb lighting (With the bomb lighting)
New man on the Minnesota Vikings (Minnesota Vikings)
Truth hurts, needed something more exciting (Yee)
Bom bom bi dom bi dum bum bay (Eh, yeah, yeah, yeah)

[Verse 2]
You tried to break my heart?
Oh, that breaks my heart
That you thought you ever had it
No, you ain't from the start
Hey, I'm glad you're back with your bitch
I mean, who would wanna hide this?
I will never, ever, ever, ever, ever be your side chick
I put the sing in single
Ain't worried 'bout a ring on my finger
So you can tell your friend, ""Shoot your shot"" when you see him
It's okay, he already in my DMs

[Chorus]
Why men great 'til they gotta be great? ('Til they gotta be great)
Don't text me, tell it straight to my face (Tell it straight to my face)
Best friend sat me down in the salon chair (Down in the salon chair)
Shampoo press, get you out of my hair
Fresh photos with the bomb lighting (With the bomb lighting)
New man on the Minnesota Vikings (Minnesota Vikings)
Truth hurts, needed something more exciting (Yee)
Bom bom bi dom bi dum bum bay (Eh, yeah, yeah, yeah)

[Bridge]
I'ma hit you back in a minute (Yeah, yeah)
I don't play tag, bitch, I been it (One time)
We don't fuck with lies (Two times), we don't do goodbyes (Woo)
We just keep it pushing like ay-ay-ay
I'ma hit you back in a minute (Yeah, yeah)
I don't play tag, bitch, I been it (One time)
We don't fuck with lies (Two times), we don't do goodbyes (Woo)
We just keep it pushing like ay-ay-ay (Woo)

[Chorus]
Why men great 'til they gotta be great? ('Til they gotta be great)
Don't text me, tell it straight to my face (Tell it straight to my face)
Best friend sat me down in the salon chair (Down in the salon chair)
Shampoo press, get you out of my hair
Fresh photos with the bomb lighting (With the bomb lighting)
New man on the Minnesota Vikings (Minnesota Vikings)
Truth hurts, needed something more exciting (Yee)
Bom bom bi dom bi dum bum bay (Eh, yeah, yeah, yeah)

[Outro]
With the bomb lighting
Minnesota Vikings
Yee, eh, yeah, yeah, yeah","Melissa Jefferson (born April 27, 1988 in Detroit, Michigan, U.S.), known professionally as Lizzo, is an American rapper and singer. She is a founding member of indie hip hop groups The Chalice, Grrrl Prty, The Clerb, Ellypseas, and Absynthe. Her debut album, Lizzobangers, was released in 2013. In 2015, she released her sophomore album, Big Grrrl Small World.

Born in Detroit in the late 80’s, Lizzo spent much of her formative years in the church <a href=""https://www.last.fm/music/Lizzo"">Read more on Last.fm</a>"
21,Piece Of Your Heart,MEDUZA,pop house,124,74,68,-7,7,63,153,4,3,91,"[Verse]
Show me a piece of your heart, a piece of your love
I'm calling you up to gettin' down, down, down
The way that we touch is never enough
I'm turning you up to gettin' down, down
Show me a piece of your heart, a piece of your love
I'm calling you up to gettin' down, down, down
The way that we touch is never enough
I'm turning you up to gettin' down, down, down

[Break]
What? Sorry, just quickly
What if it's da, da, da, uh, uh
Da, da, da, uh, uh
Down, down, down

[Chorus]
Uh, da, da, da, uh, uh
Da, da, da, uh, uh
Da, da, da, uh, uh
Da, da, da
Uh, da, da, da, uh, uh
Da, da, da, uh, uh
Da, da, da, uh, uh
Down, down, down

[Post-Chorus]
Show me a piece of you, show me a part of you
I'll be what you want
And if it's physical, keep it subliminal
Show me what you want
Show me a piece of you, show me a part of you
I'll be what you want
And if it's physical, keep it subliminal
Show me what you want

[Verse]
Show me a piece of your heart, a piece of your love
I'm calling you up to gettin' down, down, down
The way that we touch is never enough
I'm turning you up to gettin' down, down, down

[Interlude]
Da, da, da, uh, uh
Da, da, da, uh, uh
Da, da, da, uh, uh
Down, down, down

[Chorus]
Uh, da, da, da, uh, uh
Da, da, da, uh, uh
Da, da, da, uh, uh
Da, da, da
Uh, da, da, da, uh, uh
Da, da, da, uh, uh
Da, da, da, uh, uh
Down, down, down

[Post-Chorus]
Show me a piece of you, show me a part of you
I'll be what you want
And if it's physical, keep it subliminal
Show me what you want","There are more than one act called Meduza:

1. Meduza are an Italian production trio consisting of Luca de Gregorio, Mattia Vitale and Simone Giani. They are known for their 2019 breakthrough song ""Piece of Your Heart"" which was a collaboration with British production trio Goodboys. Meduza have created a melodic, yet energetic sound, set to be the climactic point in Ibiza's ever thriving tale of upfront musical taste making;

2. Meduza is a punk /rock band from Oslo, Norway. <a href=""https://www.last.fm/music/Meduza"">Read more on Last.fm</a>"
